{
  "schemaVersion": "1.0.0",
  "type": "audit",
  "timestamp": "2026-02-28T01:42:23.535Z",
  "counts": {
    "RED": 0,
    "YELLOW": 46,
    "GRAY": 6,
    "INFO": 1
  },
  "ecosystems": {
    "npm": 45,
    "nuget": 27,
    "pypi": 26,
    "smithery": 3,
    "flyio": 3,
    "ghcr": 0
  },
  "totalPackages": 104,
  "reportFiles": {
    "json": "reports/latest.json",
    "markdown": "reports/latest.md"
  }
}
